{
  "preparation_id": "consultation-preparation:sha256:61ea4a0be2dfd8e51b72c632d80c27784cdb5a4cac2f97bdf44a088258565f0a",
  "run_id": "consultation-preparation-run:cfd930e669b048afb469838e1b7cafbb",
  "assembler_version": "preparation-assembler-v1",
  "messages_hash": "sha256:166c900b6b00167509b67eb67df69a4921332f37687190fe1e53d3fa9d53337e",
  "family_mapping_hash": "sha256:326b488b063f5197c636fcf53a15162c5647b231aceaa2c63593cc136cf3bdd7",
  "dataset_class": "SYNTHETIC_WORK",
  "synthetic": true,
  "disclaimer": "프로젝트 시연을 위해 생성한 합성 상담 준비안이며 실제 상담 기록, 고객 정보, 은행 내부자료가 아닙니다. 항목과 근거는 Core의 승인 checklist와 합성 공문 원문에서 왔고 LLM이 생성한 문장은 없습니다.",
  "application": {
    "application_id": "SW-APPLICATION-001",
    "company_id": "SW-COMPANY-001",
    "legal_name": "가상상사 주식회사",
    "product_key": "kb-seller-loan",
    "requested_amount_krw": 150000000,
    "purpose": "온라인 판매 정산 주기 사이의 운전자금 상담 준비",
    "source_hash": "sha256:26a33656fe31638be9271fee0a600c6100b7ee03f0dacb93f966942d84d7e270"
  },
  "business_date": "2026-10-05",
  "generated_at": "2026-10-07T18:02:52Z",
  "status": "HOLD",
  "preparation_complete": false,
  "headline": "공문군 2개 가운데 준비된 필수 공문군이 없습니다. 필수 공문군 2개(SIN-PREPAYMENT-FEE, SIN-SELLER-CHECKLIST) 확인 남음. 상담 준비가 끝나지 않았습니다.",
  "remaining_checks": [
    {
      "family_id": "SIN-PREPAYMENT-FEE",
      "required": true,
      "hold_kind": "CORE_DECISION",
      "blocking_reasons": [
        "APPROVED_CHECKLIST_NOTICE_MISMATCH",
        "HUMAN_REVIEW_PENDING"
      ],
      "hold_message": "Core가 사용 불가로 판정했습니다. 적용 일정의 checklist가 선택된 공문과 맞지 않아 쓸 수 없습니다. 변경안이 담당 부서의 검토 대기 상태라 승인 checklist를 아직 쓸 수 없습니다.",
      "manual_checklist_notice": "보류된 공문군은 Core의 적용 공문 조회(GET /api/v1/internal-policy/checklists/SIN-PREPAYMENT-FEE/applicable) 또는 수기 checklist로 확인하세요."
    },
    {
      "family_id": "SIN-SELLER-CHECKLIST",
      "required": true,
      "hold_kind": "CORE_DECISION",
      "blocking_reasons": [
        "APPROVED_CHECKLIST_NOTICE_MISMATCH",
        "HUMAN_REVIEW_PENDING"
      ],
      "hold_message": "Core가 사용 불가로 판정했습니다. 적용 일정의 checklist가 선택된 공문과 맞지 않아 쓸 수 없습니다. 변경안이 담당 부서의 검토 대기 상태라 승인 checklist를 아직 쓸 수 없습니다.",
      "manual_checklist_notice": "보류된 공문군은 Core의 적용 공문 조회(GET /api/v1/internal-policy/checklists/SIN-SELLER-CHECKLIST/applicable) 또는 수기 checklist로 확인하세요."
    }
  ],
  "optional_holds": [],
  "sections": [
    {
      "family_id": "SIN-PREPAYMENT-FEE",
      "required": true,
      "status": "HOLD",
      "hold_kind": "CORE_DECISION",
      "hold_claim_basis": "CORE_REPORTED",
      "evaluated_at": "2026-10-05T04:00:00Z",
      "selected_notice": {
        "notice_id": "SIN-PREPAYMENT-FEE-V2",
        "version": 2,
        "title": "[합성] 기업여신 중도상환수수료 기준 변경 안내 v2",
        "effective_from": "2026-10-01",
        "effective_to": null
      },
      "approved_checklist": null,
      "items": [],
      "blocking_reasons": [
        "APPROVED_CHECKLIST_NOTICE_MISMATCH",
        "HUMAN_REVIEW_PENDING"
      ],
      "warning_reasons": [],
      "hold_message": "Core가 사용 불가로 판정했습니다. 적용 일정의 checklist가 선택된 공문과 맞지 않아 쓸 수 없습니다. 변경안이 담당 부서의 검토 대기 상태라 승인 checklist를 아직 쓸 수 없습니다.",
      "manual_checklist_notice": "보류된 공문군은 Core의 적용 공문 조회(GET /api/v1/internal-policy/checklists/SIN-PREPAYMENT-FEE/applicable) 또는 수기 checklist로 확인하세요.",
      "tool_response_hash": "sha256:c69b0e4843e065a5017bae7645d47de1b3ec41c557ef863cd9edff517cc330ef"
    },
    {
      "family_id": "SIN-SELLER-CHECKLIST",
      "required": true,
      "status": "HOLD",
      "hold_kind": "CORE_DECISION",
      "hold_claim_basis": "CORE_REPORTED",
      "evaluated_at": "2026-10-05T04:00:00Z",
      "selected_notice": {
        "notice_id": "SIN-SELLER-CHECKLIST-V2",
        "version": 2,
        "title": "[합성] 셀러론 상담 준비 체크리스트 안내 v2",
        "effective_from": "2026-10-01",
        "effective_to": null
      },
      "approved_checklist": null,
      "items": [],
      "blocking_reasons": [
        "APPROVED_CHECKLIST_NOTICE_MISMATCH",
        "HUMAN_REVIEW_PENDING"
      ],
      "warning_reasons": [],
      "hold_message": "Core가 사용 불가로 판정했습니다. 적용 일정의 checklist가 선택된 공문과 맞지 않아 쓸 수 없습니다. 변경안이 담당 부서의 검토 대기 상태라 승인 checklist를 아직 쓸 수 없습니다.",
      "manual_checklist_notice": "보류된 공문군은 Core의 적용 공문 조회(GET /api/v1/internal-policy/checklists/SIN-SELLER-CHECKLIST/applicable) 또는 수기 checklist로 확인하세요.",
      "tool_response_hash": "sha256:6ccc93de876722be6aee7762bfc3d618c31a9ce93eda5723b49d5d7c765fa0bf"
    }
  ],
  "notices": {
    "human_decision_notice": "이 준비안은 확인할 항목과 근거만 담습니다. 승인·거절·한도·금리·신용등급은 이 준비안이 정하지 않으며 담당자가 판단합니다.",
    "source_notice": "항목은 Core의 승인 checklist이고 근거는 공문 원문의 규칙 문장과 위치입니다. 시행일·조건·예외 같은 값은 항목의 구조화 값이며 원문 직접 인용이 아닙니다.",
    "usage_notice": "Core에 기록됐습니다. 기록은 사용 허가가 아니므로 사용 전 Core 조회로 사용 가능 여부를 다시 확인하세요."
  },
  "record": {
    "recorded": true,
    "status": "RECORDED",
    "core_preparation_id": "consultation-preparation:sha256:61ea4a0be2dfd8e51b72c632d80c27784cdb5a4cac2f97bdf44a088258565f0a",
    "recorded_at": "2026-10-05T04:00:00Z"
  },
  "consultation_id": "e2e-3"
}
